{
  "id": "19cb5123-900d-4f7f-a65f-66d9126b578f",
  "key": "kuvendore-2025",
  "createdAt": "2021-01-01T00:00:00+01:00",
  "title": "Zgjedhjet kuvendore në Shqipëri 2025",
  "shortTitle": "Zgjedhjet kuvendore 2025",
  "calculatorGroup": {
    "id": "70db0917-5a3c-48ff-9f6f-c11eb1d34bd3",
    "key": "kuvendore-2025"
  },
  "votingHours": [
    {
      "start": "2025-02-09T07:00:00+01:00",
      "end": "2025-02-09T17:00:00+01:00"
    }
  ]
}