{
  "id": "412d0370-7c88-4184-ae7e-befabc4f6ebf",
  "key": "parlamentare-2025",
  "createdAt": "2021-01-01T00:00:00+01:00",
  "title": "Zgjedhjet parlamentare në Kosovë 2025",
  "shortTitle": "Zgjedhjet parlamentare 2025",
  "calculatorGroup": {
    "id": "4ffa236f-5ee0-4d5d-9703-c6a5786d6295",
    "key": "parlamentare-2025"
  },
  "votingHours": [
    {
      "start": "2025-02-09T07:00:00+01:00",
      "end": "2025-02-09T17:00:00+01:00"
    }
  ]
}