{
  "id": "aa90257e-8123-46a6-98c6-fd8bccffaa71",
  "key": "wien-wahl-2025",
  "createdAt": "2021-01-01T00:00:00+01:00",
  "title": "Wien-Wahl 2025",
  "shortTitle": "Wien-Wahl 2025",
  "calculatorGroup": {
    "id": "379cac18-71b1-438d-833c-9d0334ed08b5",
    "key": "wien-wahl-2025"
  },
  "votingHours": [
    {
      "start": "2025-04-27T07:00:00+02:00",
      "end": "2025-04-27T17:00:00+02:00"
    }
  ]
}
