{
  "id": "57a09a41-631b-4b40-ac22-b75b8ce14d84",
  "key": "nrsr-2023",
  "createdAt": "2021-01-01T00:00:00+01:00",
  "title": "Voľby do Národnej rady Slovenskej republiky 2023",
  "shortTitle": "Parlamentné voľby 2023",
  "calculatorGroup": {
    "id": "05c64bc5-aa2e-4457-ab30-336f7cf9131b",
    "key": "nrsr-2023"
  },
  "rounds": [
    {
      "number": 0,
      "votingHours": [
        {
          "start": "2023-09-30",
          "end": "2023-09-30"
        }
      ]
    }
  ]
}
