{
  "id": "7d6fde2b-9e69-4caa-8cdd-906d0685fa09",
  "key": "parlamentare-2024",
  "createdAt": "2024-11-27T11:24:24.870280",
  "title": "Alegeri parlamentare în România 2024",
  "shortTitle": "Alegeri parlamentare în România 2024",
  "calculatorGroup": {
    "id": "33a20a4d-bf6b-4414-80ec-e1e270840c29",
    "key": "parlamentare-2024"
  }
}